{
  "action_recommendation": "risk_on",
  "as_of_ts": "2026-02-05T13:30:00Z",
  "confidence": 82.0,
  "config_hash": "ce5c00a614ea5410947ca1e7582cc6f572c90297dab35f4532955bad15a00511",
  "guardrails": [],
  "inputs_hash": "fixturehash",
  "market_phase": "trend_up",
  "playbook": "trend_follow",
  "rationale": [
    "market_phase=trend_up",
    "confidence=82.00",
    "trend_regime=trend_up, vol_regime=normal, risk_tone=risk_on",
    "trend regime with confidence >= threshold"
  ],
  "risk_tone": "risk_on",
  "rules_fired": [
    "playbook.trend_follow"
  ],
  "schema_version": 1,
  "snapshot_id": "00000000000000000000000000000001",
  "snapshot_schema_version": 1,
  "strategy_config_hash": "ce5c00a614ea5410947ca1e7582cc6f572c90297dab35f4532955bad15a00511",
  "strategy_config_source": "config/strategy_v1.yaml",
  "strategy_inputs": {
    "confidence": 82.0,
    "market_phase": "trend_up",
    "recent_change_window_days": 20,
    "risk_tone": "risk_on",
    "trend_regime": "trend_up",
    "vol_regime": "normal",
    "vote_disagreement_score": 0.0
  },
  "strategy_version": "strategy_v1",
  "trend_regime": "trend_up",
  "vol_regime": "normal"
}